"name","mana_cost","combined_mana_cost","card_text","power","toughness","standard","commander","type","First_keyword","Second_keyword","Third_keyword","Fourth_keyword","Fifth_keyword","layout","prints_search_uri","rarity","number_keywords","Flying","Deathtouch","Haste","Vigilance","Broad_type","sanitised_name","Sixth_keyword"
"Battle Cry Goblin","{1}{R}",2,"{1}{R}: Goblins you control get +1/+0 and gain haste until end of turn.Pack tactics — Whenever this creature attacks, if you attacked with creatures with total power 6 or greater this combat, create a 1/1 red Goblin creature token that's tapped and attacking.",2,2,"not_legal","legal","Creature — Goblin","Pack tactics",NA,NA,NA,NA,"normal","https://api.scryfall.com/cards/search?order=released&q=oracleid%3Ae74c4001-d958-4d2b-b57d-c3601f01580c&unique=prints","uncommon",1,"Not flying","Not deathtouch","Not haste","Not vigilance","Creature","Battle Cry Goblin",NA
"Battle-Scarred Goblin","{1}{R}",2,"Whenever this creature becomes blocked, it deals 1 damage to each creature blocking it.",2,2,"not_legal","legal","Creature — Goblin Warrior",NA,NA,NA,NA,NA,"normal","https://api.scryfall.com/cards/search?order=released&q=oracleid%3A3e765710-e567-4af0-b5f5-7c182649b757&unique=prints","common",NA,"Not flying","Not deathtouch","Not haste","Not vigilance","Creature","Battle-Scarred Goblin",NA
"Burning Hands","{1}{R}",2,"Burning Hands deals 2 damage to target creature or planeswalker. If that permanent is green, Burning Hands deals 6 damage instead.",NA,NA,"not_legal","legal","Instant",NA,NA,NA,NA,NA,"normal","https://api.scryfall.com/cards/search?order=released&q=oracleid%3A51a0d1c2-ff29-4ac9-84a2-ad4f566fee8d&unique=prints","uncommon",NA,"Not flying","Not deathtouch","Not haste","Not vigilance","Instant","Burning Hands",NA
"Bloodboil Sorcerer","{3}{R}",4,"When this creature enters, you take the initiative.Crown of Madness — {1}{R}, Sacrifice an artifact or creature: Goad target creature. (Until your next turn, that creature attacks each combat if able and attacks a player other than you if able.)",3,3,"not_legal","legal","Creature — Human Shaman","Goad","Crown of Madness",NA,NA,NA,"normal","https://api.scryfall.com/cards/search?order=released&q=oracleid%3Aacdcffa0-87e5-48a2-93d2-572febfc9d52&unique=prints","uncommon",2,"Not flying","Not deathtouch","Not haste","Not vigilance","Creature","Bloodboil Sorcerer",NA
"Boots of Speed","{R}",1,"Equipped creature gets +1/+0 and has haste.Equip {1} ({1}: Attach to target creature you control. Equip only as a sorcery.)",NA,NA,"not_legal","legal","Artifact — Equipment","Equip",NA,NA,NA,NA,"normal","https://api.scryfall.com/cards/search?order=released&q=oracleid%3A6f6601bc-cb12-4054-9027-e4a0ebdae1a3&unique=prints","common",1,"Not flying","Not deathtouch","Not haste","Not vigilance","Artifact","Boots of Speed",NA
"Bhaal's Invoker","{2}{R}",3,"Scorching Ray — {8}: This creature deals 4 damage to each opponent.",4,2,"not_legal","legal","Creature — Dragon Shaman","Scorching Ray",NA,NA,NA,NA,"normal","https://api.scryfall.com/cards/search?order=released&q=oracleid%3A92512acd-bf1e-4133-93cd-6c6af5affb95&unique=prints","common",1,"Not flying","Not deathtouch","Not haste","Not vigilance","Creature","Bhaals Invoker",NA
"Great Hall of the Citadel",NA,0,"{T}: Add {C}.{1}, {T}: Add two mana in any combination of colors. Spend this mana only to cast legendary spells.",NA,NA,"not_legal","legal","Land",NA,NA,NA,NA,NA,"normal","https://api.scryfall.com/cards/search?order=released&q=oracleid%3Ab3e28bcf-0ed0-4406-b615-68ddc55b349a&unique=prints","common",NA,"Not flying","Not deathtouch","Not haste","Not vigilance","Land","Great Hall of the Citadel",NA
"Gut, True Soul Zealot","{2}{R}",3,"Whenever you attack, you may sacrifice another creature or an artifact. If you do, create a 4/1 black Skeleton creature token with menace that's tapped and attacking. (It can't be blocked except by two or more creatures.)Choose a Background (You can have a Background as a second commander.)",2,2,"not_legal","legal","Legendary Creature — Goblin Shaman","Choose a background",NA,NA,NA,NA,"normal","https://api.scryfall.com/cards/search?order=released&q=oracleid%3A60e7130a-d321-4e50-93a4-999013c76054&unique=prints","uncommon",1,"Not flying","Not deathtouch","Not haste","Not vigilance","Creature","Gut, True Soul Zealot",NA
"Goblin Morningstar","{1}{R}",2,"Equipped creature gets +1/+0 and has trample.Equip {1}{R}When this Equipment enters, roll a d20.1—9 | Create a 1/1 red Goblin creature token.10—20 | Create a 1/1 red Goblin creature token, then attach this Equipment to it.",NA,NA,"not_legal","legal","Artifact — Equipment","Equip",NA,NA,NA,NA,"normal","https://api.scryfall.com/cards/search?order=released&q=oracleid%3A61ff247e-a119-4f35-af62-2645d6762bba&unique=prints","uncommon",1,"Not flying","Not deathtouch","Not haste","Not vigilance","Artifact","Goblin Morningstar",NA
"Gnoll War Band","{5}{R}",6,"This spell costs {1} less to cast for each opponent who was dealt damage this turn.MenaceMyriad (Whenever this creature attacks, for each opponent other than defending player, you may create a token copy that's tapped and attacking that player or a planeswalker they control. Exile the tokens at end of combat.)",5,5,"not_legal","legal","Creature — Gnoll","Menace","Myriad",NA,NA,NA,"normal","https://api.scryfall.com/cards/search?order=released&q=oracleid%3Aff8fc718-6218-48f3-981d-c4d2bc468493&unique=prints","uncommon",2,"Not flying","Not deathtouch","Not haste","Not vigilance","Creature","Gnoll War Band",NA
"Coronation of Chaos","{2}{R}",3,"Up to three target creatures can't block this turn. Goad them. (Until your next turn, those creatures attack each combat if able and attack a player other than you if able.)",NA,NA,"not_legal","legal","Sorcery","Goad",NA,NA,NA,NA,"normal","https://api.scryfall.com/cards/search?order=released&q=oracleid%3A46f1618d-9c95-4a4b-9a20-7c378b811849&unique=prints","common",1,"Not flying","Not deathtouch","Not haste","Not vigilance","Sorcery","Coronation of Chaos",NA
"Chaos Channeler","{2}{R}{R}",4,"Wild Magic Surge — Whenever this creature attacks, roll a d20.1—9 | Exile the top card of your library. You may play it this turn.10—19 | Exile the top two cards of your library. You may play them this turn.20 | Exile the top three cards of your library. You may play them this turn.",4,3,"not_legal","legal","Creature — Human Shaman",NA,NA,NA,NA,NA,"normal","https://api.scryfall.com/cards/search?order=released&q=oracleid%3Aea9031de-6169-4b1c-9390-7fdaf876c7cd&unique=prints","uncommon",NA,"Not flying","Not deathtouch","Not haste","Not vigilance","Creature","Chaos Channeler",NA
"Book of Mazarbul","{2}{R}",3,"(As this Saga enters and after your draw step, add a lore counter. Sacrifice after III.)I — Amass Orcs 1. (Put a +1/+1 counter on an Army you control. It's also an Orc. If you don't control an Army, create a 0/0 black Orc Army creature token first.)II — Amass Orcs 2.III — Creatures you control get +1/+0 and gain menace until end of turn.",NA,NA,"not_legal","legal","Enchantment — Saga","Amass",NA,NA,NA,NA,"saga","https://api.scryfall.com/cards/search?order=released&q=oracleid%3A4598c221-b111-4bde-b4dc-673186c4efe6&unique=prints","uncommon",1,"Not flying","Not deathtouch","Not haste","Not vigilance","Enchantment","Book of Mazarbul",NA
"Grishnákh, Brash Instigator","{2}{R}",3,"When Grishnákh enters, amass Orcs 2. When you do, until end of turn, gain control of target nonlegendary creature an opponent controls with power less than or equal to the amassed Army's power. Untap that creature. It gains haste until end of turn.",1,1,"not_legal","legal","Legendary Creature — Goblin Soldier","Amass",NA,NA,NA,NA,"normal","https://api.scryfall.com/cards/search?order=released&q=oracleid%3A1f139012-fa71-4f5f-8c57-6847bff95678&unique=prints","uncommon",1,"Not flying","Not deathtouch","Not haste","Not vigilance","Creature","Grishnákh, Brash Instigator",NA
"Hulking Bugbear","{1}{R}{R}",3,"Haste",3,3,"not_legal","legal","Creature — Goblin","Haste",NA,NA,NA,NA,"normal","https://api.scryfall.com/cards/search?order=released&q=oracleid%3Ac336eb5b-e185-4d4b-b106-3a641ba9aad1&unique=prints","uncommon",1,"Not flying","Not deathtouch","Haste","Not vigilance","Creature","Hulking Bugbear",NA
"Magic Missile","{1}{R}{R}",3,"This spell can't be countered.Magic Missile deals 3 damage divided as you choose among one, two, or three targets.",NA,NA,"not_legal","legal","Sorcery",NA,NA,NA,NA,NA,"normal","https://api.scryfall.com/cards/search?order=released&q=oracleid%3Ae48b8d78-3f8b-4bf8-853a-76c435bc31f0&unique=prints","uncommon",NA,"Not flying","Not deathtouch","Not haste","Not vigilance","Sorcery","Magic Missile",NA
"Livaan, Cultist of Tiamat","{2}{R}",3,"Whenever you cast a noncreature spell, target creature gets +X/+0 until end of turn, where X is that spell's mana value.Choose a Background (You can have a Background as a second commander.)",1,3,"not_legal","legal","Legendary Creature — Dragon Shaman","Choose a background",NA,NA,NA,NA,"normal","https://api.scryfall.com/cards/search?order=released&q=oracleid%3Aee565d5c-7a3a-481c-91aa-b982cf384220&unique=prints","uncommon",1,"Not flying","Not deathtouch","Not haste","Not vigilance","Creature","Livaan, Cultist of Tiamat",NA
"Improvised Weaponry","{2}{R}",3,"Improvised Weaponry deals 2 damage to any target. Create a Treasure token. (It's an artifact with ""{T}, Sacrifice this token: Add one mana of any color."")",NA,NA,"not_legal","legal","Sorcery","Treasure",NA,NA,NA,NA,"normal","https://api.scryfall.com/cards/search?order=released&q=oracleid%3Afa5dad0b-8e23-4b88-b383-849f7318e01f&unique=prints","common",1,"Not flying","Not deathtouch","Not haste","Not vigilance","Sorcery","Improvised Weaponry",NA
"Insufferable Balladeer","{1}{R}",2,"Vicious Mockery — When this creature enters, target creature an opponent controls can't block this turn. Goad it. (Until your next turn, that creature attacks each combat if able and attacks a player other than you if able.)",2,1,"not_legal","legal","Creature — Dwarf Bard","Goad","Vicious Mockery",NA,NA,NA,"normal","https://api.scryfall.com/cards/search?order=released&q=oracleid%3Ae6acafdf-e3ad-4ac2-bb26-cec37c7ca115&unique=prints","common",2,"Not flying","Not deathtouch","Not haste","Not vigilance","Creature","Insufferable Balladeer",NA
"Quickbeam, Upstart Ent","{4}{G}{G}",6,"Whenever Quickbeam or another Treefolk you control enters, up to two target creatures each get +2/+2 and gain trample until end of turn.",5,6,"not_legal","legal","Legendary Creature — Treefolk",NA,NA,NA,NA,NA,"normal","https://api.scryfall.com/cards/search?order=released&q=oracleid%3A9ad903c5-1528-44d6-b4b6-f05a2399d91f&unique=prints","uncommon",NA,"Not flying","Not deathtouch","Not haste","Not vigilance","Creature","Quickbeam, Upstart Ent",NA
"Purple Worm","{5}{G}{G}",7,"This spell costs {2} less to cast if a creature died this turn.Ward {2} (Whenever this creature becomes the target of a spell or ability an opponent controls, counter it unless that player pays {2}.)",8,7,"not_legal","legal","Creature — Worm","Ward",NA,NA,NA,NA,"normal","https://api.scryfall.com/cards/search?order=released&q=oracleid%3A179cc807-5150-4513-88b2-73cb05009b7d&unique=prints","uncommon",1,"Not flying","Not deathtouch","Not haste","Not vigilance","Creature","Purple Worm",NA
"Wandering Troubadour","{3}{G}",4,"At the beginning of your end step, if you had a land enter the battlefield under your control this turn, venture into the dungeon. (Enter the first room or advance to the next room.)",4,2,"not_legal","legal","Creature — Dragon Bard","Venture into the dungeon",NA,NA,NA,NA,"normal","https://api.scryfall.com/cards/search?order=released&q=oracleid%3A1a304703-6b48-4f3f-bd41-7f10ce0a751c&unique=prints","uncommon",1,"Not flying","Not deathtouch","Not haste","Not vigilance","Creature","Wandering Troubadour",NA
"Underdark Basilisk","{1}{G}",2,"Deathtouch",1,2,"not_legal","legal","Creature — Basilisk","Deathtouch",NA,NA,NA,NA,"normal","https://api.scryfall.com/cards/search?order=released&q=oracleid%3A3b61b6da-44ed-4766-8134-fca37afd3f2a&unique=prints","common",1,"Not flying","Deathtouch","Not haste","Not vigilance","Creature","Underdark Basilisk",NA
"Split the Spoils","{2}{G}",3,"Exile up to five target permanent cards from your graveyard and separate them into two piles. An opponent chooses one of those piles. Put that pile into your hand and the other into your graveyard. (Piles can be empty.)",NA,NA,"not_legal","legal","Sorcery",NA,NA,NA,NA,NA,"normal","https://api.scryfall.com/cards/search?order=released&q=oracleid%3A48ad5bd6-9568-4813-be29-99aef8b9327a&unique=prints","uncommon",NA,"Not flying","Not deathtouch","Not haste","Not vigilance","Sorcery","Split the Spoils",NA
"Skanos Dragonheart","{4}{G}",5,"Whenever Skanos Dragonheart attacks, it gets +X/+X until end of turn, where X is the greatest power among other Dragons you control and Dragon cards in your graveyard.Choose a Background (You can have a Background as a second commander.)",4,4,"not_legal","legal","Legendary Creature — Dragon Ranger","Choose a background",NA,NA,NA,NA,"normal","https://api.scryfall.com/cards/search?order=released&q=oracleid%3A250052a7-1ba5-45d2-aa32-b787fd637fa5&unique=prints","uncommon",1,"Not flying","Not deathtouch","Not haste","Not vigilance","Creature","Skanos Dragonheart",NA
"Skullwinder","{2}{G}",3,"DeathtouchWhen this creature enters, return target card from your graveyard to your hand, then choose an opponent. That player returns a card from their graveyard to their hand.",1,3,"not_legal","legal","Creature — Snake","Deathtouch",NA,NA,NA,NA,"normal","https://api.scryfall.com/cards/search?order=released&q=oracleid%3Ad3d8dd6e-a80b-4063-a542-ff67ef8dad4f&unique=prints","uncommon",1,"Not flying","Deathtouch","Not haste","Not vigilance","Creature","Skullwinder",NA
"Stew the Coneys","{2}{G}",3,"Target creature you control deals damage equal to its power to target creature you don't control. Create a Food token. (It's an artifact with ""{2}, {T}, Sacrifice this token: You gain 3 life."")",NA,NA,"not_legal","legal","Instant","Food",NA,NA,NA,NA,"normal","https://api.scryfall.com/cards/search?order=released&q=oracleid%3Af6f1b8da-5e7c-4121-9b0f-fd6678b04991&unique=prints","uncommon",1,"Not flying","Not deathtouch","Not haste","Not vigilance","Instant","Stew the Coneys",NA
"Wild Shape","{G}",1,"Choose one. Until end of turn, target creature you control has that base power and toughness, becomes that creature type, and gains that ability.• 1/3 Turtle with hexproof.• 1/5 Spider with reach.• 3/3 Elephant with trample.",NA,NA,"not_legal","legal","Instant",NA,NA,NA,NA,NA,"normal","https://api.scryfall.com/cards/search?order=released&q=oracleid%3A99f4a22a-ba33-43f0-bc58-9df8388706cd&unique=prints","uncommon",NA,"Not flying","Not deathtouch","Not haste","Not vigilance","Instant","Wild Shape",NA
"You Find a Cursed Idol","{1}{G}",2,"Choose one —• Smash It — Destroy target artifact.• Lift the Curse — Destroy target enchantment.• Steal Its Eyes — Create a Treasure token and venture into the dungeon. (Enter the first room or advance to the next room.)",NA,NA,"not_legal","legal","Sorcery","Treasure","Venture into the dungeon",NA,NA,NA,"normal","https://api.scryfall.com/cards/search?order=released&q=oracleid%3Aaa7b41ba-08eb-40b8-a8d5-e67dc09c88ba&unique=prints","common",2,"Not flying","Not deathtouch","Not haste","Not vigilance","Sorcery","You Find a Cursed Idol",NA
"Gnoll Hunter","{1}{G}",2,"Pack tactics — Whenever this creature attacks, if you attacked with creatures with total power 6 or greater this combat, put a +1/+1 counter on this creature.",2,2,"not_legal","legal","Creature — Gnoll","Pack tactics",NA,NA,NA,NA,"normal","https://api.scryfall.com/cards/search?order=released&q=oracleid%3A9e445336-8b1e-4642-b8bc-aa460ad79a3f&unique=prints","common",1,"Not flying","Not deathtouch","Not haste","Not vigilance","Creature","Gnoll Hunter",NA
"Enraged Huorn","{4}{G}",5,"TrampleWhen this creature enters, the Ring tempts you.",4,5,"not_legal","legal","Creature — Treefolk","Trample",NA,NA,NA,NA,"normal","https://api.scryfall.com/cards/search?order=released&q=oracleid%3A8a7dbf4e-f121-40c5-a688-3398e04c1311&unique=prints","common",1,"Not flying","Not deathtouch","Not haste","Not vigilance","Creature","Enraged Huorn",NA
"Ent's Fury","{1}{G}",2,"Put a +1/+1 counter on target creature you control if its power is 4 or greater. Then that creature gets +1/+1 until end of turn and fights target creature you don't control.",NA,NA,"not_legal","legal","Sorcery","Fight",NA,NA,NA,NA,"normal","https://api.scryfall.com/cards/search?order=released&q=oracleid%3A6bc3c7fd-e371-467f-973c-4c9f0d1ba0bc&unique=prints","common",1,"Not flying","Not deathtouch","Not haste","Not vigilance","Sorcery","Ents Fury",NA
"Generous Ent","{5}{G}",6,"ReachWhen this creature enters, create a Food token. (It's an artifact with ""{2}, {T}, Sacrifice this token: You gain 3 life."")Forestcycling {1} ({1}, Discard this card: Search your library for a Forest card, reveal it, put it into your hand, then shuffle.)",5,7,"not_legal","legal","Creature — Treefolk","Reach","Landcycling","Food","Forestcycling","Typecycling","normal","https://api.scryfall.com/cards/search?order=released&q=oracleid%3Ab6859c7a-4c4d-4652-938f-ecedce29d506&unique=prints","common",6,"Not flying","Not deathtouch","Not haste","Not vigilance","Creature","Generous Ent","Cycling"
"Owlbear","{3}{G}{G}",5,"TrampleKeen Senses — When this creature enters, draw a card.",4,4,"not_legal","legal","Creature — Bird Bear","Trample",NA,NA,NA,NA,"normal","https://api.scryfall.com/cards/search?order=released&q=oracleid%3A0fab815f-bccf-40ef-95e9-ba64b137fb8c&unique=prints","common",1,"Not flying","Not deathtouch","Not haste","Not vigilance","Creature","Owlbear",NA
"Owlbear Shepherd","{2}{G}",3,"At the beginning of your end step, if creatures you control have total power 8 or greater, draw a card.",1,4,"not_legal","legal","Creature — Goblin Druid",NA,NA,NA,NA,NA,"normal","https://api.scryfall.com/cards/search?order=released&q=oracleid%3Ae81035b5-d922-48f8-af20-0025da4721c6&unique=prints","uncommon",NA,"Not flying","Not deathtouch","Not haste","Not vigilance","Creature","Owlbear Shepherd",NA
"Explore the Underdark","{4}{G}",5,"Search your library for up to two basic land cards and/or Gate cards, put them onto the battlefield tapped, then shuffle.You take the initiative.",NA,NA,"not_legal","legal","Sorcery",NA,NA,NA,NA,NA,"normal","https://api.scryfall.com/cards/search?order=released&q=oracleid%3A13bad22a-6ba3-4197-8658-e47049a1cf1f&unique=prints","uncommon",NA,"Not flying","Not deathtouch","Not haste","Not vigilance","Sorcery","Explore the Underdark",NA
"Ambitious Dragonborn","{3}{G}",4,"This creature enters with X +1/+1 counters on it, where X is the greatest power among creatures you control and creature cards in your graveyard.",0,0,"not_legal","legal","Creature — Dragon Barbarian",NA,NA,NA,NA,NA,"normal","https://api.scryfall.com/cards/search?order=released&q=oracleid%3A934094d6-c897-4ae2-89cd-08d106600d3c&unique=prints","common",NA,"Not flying","Not deathtouch","Not haste","Not vigilance","Creature","Ambitious Dragonborn",NA
"Band Together","{2}{G}",3,"Up to two target creatures you control each deal damage equal to their power to another target creature.",NA,NA,"not_legal","legal","Instant",NA,NA,NA,NA,NA,"normal","https://api.scryfall.com/cards/search?order=released&q=oracleid%3Aa8631e87-bfc3-463b-bdd1-974ea1d79ae4&unique=prints","common",NA,"Not flying","Not deathtouch","Not haste","Not vigilance","Instant","Band Together",NA
"Circle of the Moon Druid","{2}{G}",3,"Bear Form — During your turn, this creature is a Bear with base power and toughness 4/2. (It loses all other creature types.)",2,4,"not_legal","legal","Creature — Human Elf Druid",NA,NA,NA,NA,NA,"normal","https://api.scryfall.com/cards/search?order=released&q=oracleid%3A90569b99-8b63-4d2e-b7de-b578b8adbdcb&unique=prints","common",NA,"Not flying","Not deathtouch","Not haste","Not vigilance","Creature","Circle of the Moon Druid",NA
"Bombadil's Song","{1}{G}",2,"Target creature you control gets +1/+1 and gains hexproof until end of turn. The Ring tempts you. (A creature with hexproof can't be the target of spells or abilities your opponents control.)",NA,NA,"not_legal","legal","Instant",NA,NA,NA,NA,NA,"normal","https://api.scryfall.com/cards/search?order=released&q=oracleid%3A60092fb4-98db-4f2d-a5d7-24b5f11c8acc&unique=prints","common",NA,"Not flying","Not deathtouch","Not haste","Not vigilance","Instant","Bombadils Song",NA
"Green Dragon","{4}{G}{G}",6,"FlyingPoison Breath — When this creature enters, until end of turn, whenever a creature an opponent controls is dealt damage, destroy it.",4,4,"not_legal","legal","Creature — Dragon","Flying",NA,NA,NA,NA,"normal","https://api.scryfall.com/cards/search?order=released&q=oracleid%3Ac2a4c6c7-e5b4-4cc8-91d8-5de8cc95ed00&unique=prints","uncommon",1,"Flying","Not deathtouch","Not haste","Not vigilance","Creature","Green Dragon",NA
"Halsin, Emerald Archdruid","{3}{G}",4,"{1}: Until end of turn, target token you control becomes a green Bear creature with base power and toughness 4/4 in addition to its other colors and types.Choose a Background (You can have a Background as a second commander.)",2,4,"not_legal","legal","Legendary Creature — Elf Druid","Choose a background",NA,NA,NA,NA,"normal","https://api.scryfall.com/cards/search?order=released&q=oracleid%3A01ab3603-6c2f-4d65-9bb2-da95efdbe622&unique=prints","uncommon",1,"Not flying","Not deathtouch","Not haste","Not vigilance","Creature","Halsin, Emerald Archdruid",NA
"Hunter's Mark","{3}{G}",4,"This spell costs {3} less to cast if it targets a blue permanent you don't control.This spell can't be countered.Target creature you control gets +1/+1 until end of turn. Then it deals damage equal to its power to target creature or planeswalker you don't control.",NA,NA,"not_legal","legal","Instant",NA,NA,NA,NA,NA,"normal","https://api.scryfall.com/cards/search?order=released&q=oracleid%3A7def9bfe-6a59-4300-8134-fce7508dca38&unique=prints","uncommon",NA,"Not flying","Not deathtouch","Not haste","Not vigilance","Instant","Hunters Mark",NA
"Long List of the Ents","{G}",1,"(As this Saga enters and after your draw step, add a lore counter. Sacrifice after VI.)I, II, III, IV, V, VI — Note a creature type that hasn't been noted for this Saga. When you next cast a creature spell of that type this turn, that creature enters with an additional +1/+1 counter on it.",NA,NA,"not_legal","legal","Enchantment — Saga",NA,NA,NA,NA,NA,"saga","https://api.scryfall.com/cards/search?order=released&q=oracleid%3A01376449-5cd2-4079-8aaa-5128634ef20b&unique=prints","uncommon",NA,"Not flying","Not deathtouch","Not haste","Not vigilance","Enchantment","Long List of the Ents",NA
"Long Rest","{X}{G}{G}{G}",3,"Return X target cards with different mana values from your graveyard to your hand. If eight or more cards were returned to your hand this way, your life total becomes equal to your starting life total. Exile Long Rest.",NA,NA,"not_legal","legal","Sorcery",NA,NA,NA,NA,NA,"normal","https://api.scryfall.com/cards/search?order=released&q=oracleid%3Afc8df5c8-fda6-454c-a1ac-21c6e3d75b9c&unique=prints","rare",NA,"Not flying","Not deathtouch","Not haste","Not vigilance","Sorcery","Long Rest",NA
"Wizard's Rockets","{1}",1,"This artifact enters tapped.{X}, {T}, Sacrifice this artifact: Add X mana in any combination of colors.When this artifact is put into a graveyard from the battlefield, draw a card.",NA,NA,"not_legal","legal","Artifact",NA,NA,NA,NA,NA,"normal","https://api.scryfall.com/cards/search?order=released&q=oracleid%3A755153b5-81b8-4ebc-b6f8-9296654fcaa4&unique=prints","common",NA,"Not flying","Not deathtouch","Not haste","Not vigilance","Artifact","Wizards Rockets",NA
"Spiked Pit Trap","{1}",1,"Flash{5}, {T}, Sacrifice this artifact: Choose target creature, then roll a d20.1—9 | This artifact deals 5 damage to that creature.10—20 | This artifact deals 5 damage to that creature. Create a Treasure token.",NA,NA,"not_legal","legal","Artifact","Treasure","Flash",NA,NA,NA,"normal","https://api.scryfall.com/cards/search?order=released&q=oracleid%3Aa0aa1aa1-f011-4c65-9886-95521947beef&unique=prints","common",2,"Not flying","Not deathtouch","Not haste","Not vigilance","Artifact","Spiked Pit Trap",NA
"Stone of Erech","{1}",1,"If a creature an opponent controls would die, exile it instead.{2}, {T}, Sacrifice Stone of Erech: Exile target player's graveyard. Draw a card.",NA,NA,"not_legal","legal","Legendary Artifact",NA,NA,NA,NA,NA,"normal","https://api.scryfall.com/cards/search?order=released&q=oracleid%3A73dad679-1edb-41c9-9d43-56dc93c3e9fe&unique=prints","uncommon",NA,"Not flying","Not deathtouch","Not haste","Not vigilance","Artifact","Stone of Erech",NA
"Dire Mimic","{2}",2,"Flash{T}, Sacrifice this artifact: Add one mana of any color.{3}: This artifact becomes a Shapeshifter artifact creature with base power and toughness 5/5 until end of turn.",NA,NA,"not_legal","legal","Artifact — Treasure","Flash",NA,NA,NA,NA,"normal","https://api.scryfall.com/cards/search?order=released&q=oracleid%3Ab657b3df-9287-44cf-a1cd-a80ead71a553&unique=prints","common",1,"Not flying","Not deathtouch","Not haste","Not vigilance","Artifact","Dire Mimic",NA
