"name","mana_cost","combined_mana_cost","card_text","power","toughness","standard","commander","type","First_keyword","Second_keyword","Third_keyword","Fourth_keyword","Fifth_keyword","layout","prints_search_uri","rarity","number_keywords","Flying","Deathtouch","Haste","Vigilance","Broad_type","sanitised_name","Sixth_keyword"
"Byrke, Long Ear of the Law","{4}{G}{W}",6,"VigilanceWhen Byrke enters, put a +1/+1 counter on each of up to two target creatures.Whenever a creature you control with a +1/+1 counter on it attacks, double the number of +1/+1 counters on it.",4,4,"legal","legal","Legendary Creature — Rabbit Soldier","Vigilance",NA,NA,NA,NA,"normal","https://api.scryfall.com/cards/search?order=released&q=oracleid%3Ae9c6e4e6-0c3f-4048-93e6-161a1221ea36&unique=prints","mythic",1,"Not flying","Not deathtouch","Not haste","Vigilance","Creature","Byrke, Long Ear of the Law",NA
"Fecund Greenshell","{3}{G}{G}",5,"ReachAs long as you control ten or more lands, creatures you control get +2/+2.Whenever this creature or another creature you control with toughness greater than its power enters, look at the top card of your library. If it's a land card, you may put it onto the battlefield tapped. Otherwise, put it into your hand.",4,6,"legal","legal","Creature — Elemental Turtle","Reach",NA,NA,NA,NA,"normal","https://api.scryfall.com/cards/search?order=released&q=oracleid%3Aa090be5a-b0f2-4c17-8f7d-e742f9de8f6b&unique=prints","rare",1,"Not flying","Not deathtouch","Not haste","Not vigilance","Creature","Fecund Greenshell",NA
"Finneas, Ace Archer","{G}{W}",2,"Vigilance, reachWhenever Finneas attacks, put a +1/+1 counter on each other creature you control that's a token or a Rabbit. Then if creatures you control have total power 10 or greater, draw a card.",2,2,"legal","legal","Legendary Creature — Rabbit Archer","Reach","Vigilance",NA,NA,NA,"normal","https://api.scryfall.com/cards/search?order=released&q=oracleid%3A69924636-138e-4baa-a378-0fd7df5b847d&unique=prints","rare",2,"Not flying","Not deathtouch","Not haste","Vigilance","Creature","Finneas, Ace Archer",NA
"Serra Redeemer","{3}{W}{W}",5,"FlyingWhenever another creature you control with power 2 or less enters, put two +1/+1 counters on that creature.",2,4,"legal","legal","Creature — Angel Soldier","Flying",NA,NA,NA,NA,"normal","https://api.scryfall.com/cards/search?order=released&q=oracleid%3A39bb051f-1ca7-4d9b-b33b-7f559f816e3e&unique=prints","rare",1,"Flying","Not deathtouch","Not haste","Not vigilance","Creature","Serra Redeemer",NA
"Burrowguard Mentor","{G}{W}",2,"TrampleBurrowguard Mentor's power and toughness are each equal to the number of creatures you control.",NA,NA,"legal","legal","Creature — Rabbit Soldier","Trample",NA,NA,NA,NA,"normal","https://api.scryfall.com/cards/search?order=released&q=oracleid%3Af293da27-e42d-4e87-8b61-d3c27e4c6d71&unique=prints","uncommon",1,"Not flying","Not deathtouch","Not haste","Not vigilance","Creature","Burrowguard Mentor",NA
"Clifftop Lookout","{2}{G}",3,"ReachWhen this creature enters, reveal cards from the top of your library until you reveal a land card. Put that card onto the battlefield tapped and the rest on the bottom of your library in a random order.",1,2,"legal","legal","Creature — Frog Scout","Reach",NA,NA,NA,NA,"normal","https://api.scryfall.com/cards/search?order=released&q=oracleid%3A446db5a4-21b0-44c1-b12b-d365313dd67a&unique=prints","uncommon",1,"Not flying","Not deathtouch","Not haste","Not vigilance","Creature","Clifftop Lookout",NA
"Druid of the Spade","{2}{G}",3,"As long as you control a token, this creature gets +2/+0 and has trample.",2,3,"legal","legal","Creature — Rabbit Druid",NA,NA,NA,NA,NA,"normal","https://api.scryfall.com/cards/search?order=released&q=oracleid%3A9740ce6d-ef6b-4d70-839a-8bd5e0e1e0a1&unique=prints","common",NA,"Not flying","Not deathtouch","Not haste","Not vigilance","Creature","Druid of the Spade",NA
"Pileated Provisioner","{4}{W}",5,"FlyingWhen this creature enters, put a +1/+1 counter on target creature you control without flying.",3,4,"legal","legal","Creature — Bird Scout","Flying",NA,NA,NA,NA,"normal","https://api.scryfall.com/cards/search?order=released&q=oracleid%3A0534e20d-8352-4d9f-a617-378070602673&unique=prints","common",1,"Flying","Not deathtouch","Not haste","Not vigilance","Creature","Pileated Provisioner",NA
"Treeguard Duo","{3}{G}",4,"When this creature enters, until end of turn, target creature you control gains vigilance and gets +X/+X, where X is the number of creatures you control.",3,4,"legal","legal","Creature — Frog Rabbit",NA,NA,NA,NA,NA,"normal","https://api.scryfall.com/cards/search?order=released&q=oracleid%3Ad7dfb4d5-8510-4904-abb7-834ec65d9bf3&unique=prints","common",NA,"Not flying","Not deathtouch","Not haste","Not vigilance","Creature","Treeguard Duo",NA
"Warren Elder","{1}{W}",2,"{3}{W}: Creatures you control get +1/+1 until end of turn.",2,2,"legal","legal","Creature — Rabbit Cleric",NA,NA,NA,NA,NA,"normal","https://api.scryfall.com/cards/search?order=released&q=oracleid%3A33fcb05b-246d-4b82-8b0f-44d5f891b612&unique=prints","common",NA,"Not flying","Not deathtouch","Not haste","Not vigilance","Creature","Warren Elder",NA
"Rabbit Response","{2}{W}{W}",4,"Creatures you control get +2/+1 until end of turn. If you control a Rabbit, scry 2. (Look at the top two cards of your library, then put any number of them on the bottom and the rest on top in any order.)",NA,NA,"legal","legal","Instant","Scry",NA,NA,NA,NA,"normal","https://api.scryfall.com/cards/search?order=released&q=oracleid%3A9f7abd7d-1087-495c-8a52-2a2368cc1032&unique=prints","common",1,"Not flying","Not deathtouch","Not haste","Not vigilance","Instant","Rabbit Response",NA
"Repel Calamity","{1}{W}",2,"Destroy target creature with power or toughness 4 or greater.",NA,NA,"legal","legal","Instant",NA,NA,NA,NA,NA,"normal","https://api.scryfall.com/cards/search?order=released&q=oracleid%3Aba58f508-8036-496c-8a2f-c1e410165e93&unique=prints","uncommon",NA,"Not flying","Not deathtouch","Not haste","Not vigilance","Instant","Repel Calamity",NA
"Hop to It","{2}{W}",3,"Create three 1/1 white Rabbit creature tokens.",NA,NA,"legal","legal","Sorcery",NA,NA,NA,NA,NA,"normal","https://api.scryfall.com/cards/search?order=released&q=oracleid%3Ae8a9350a-07c1-47ed-8c4f-88e4b3b17545&unique=prints","uncommon",NA,"Not flying","Not deathtouch","Not haste","Not vigilance","Sorcery","Hop to It",NA
"Rabid Bite","{1}{G}",2,"Target creature you control deals damage equal to its power to target creature you don't control.",NA,NA,"legal","legal","Sorcery",NA,NA,NA,NA,NA,"normal","https://api.scryfall.com/cards/search?order=released&q=oracleid%3A6d5dc34b-3eea-4b77-8db7-94bc30b14c4c&unique=prints","common",NA,"Not flying","Not deathtouch","Not haste","Not vigilance","Sorcery","Rabid Bite",NA
"Carrot Cake","{1}{W}",2,"When this artifact enters and when you sacrifice it, create a 1/1 white Rabbit creature token and scry 1. (Look at the top card of your library. You may put that card on the bottom.){2}, {T}, Sacrifice this artifact: You gain 3 life.",NA,NA,"legal","legal","Artifact — Food","Scry",NA,NA,NA,NA,"normal","https://api.scryfall.com/cards/search?order=released&q=oracleid%3A5fe3aabd-3271-41bf-ae50-f6efaba7c4ae&unique=prints","common",1,"Not flying","Not deathtouch","Not haste","Not vigilance","Artifact","Carrot Cake",NA
"Colossification","{5}{G}{G}",7,"Enchant creatureWhen this Aura enters, tap enchanted creature.Enchanted creature gets +20/+20.",NA,NA,"legal","legal","Enchantment — Aura","Enchant",NA,NA,NA,NA,"normal","https://api.scryfall.com/cards/search?order=released&q=oracleid%3A05c5ee65-651b-4bfb-b57f-305026507135&unique=prints","rare",1,"Not flying","Not deathtouch","Not haste","Not vigilance","Enchantment","Colossification",NA
"Blossoming Sands",NA,0,"This land enters tapped.When this land enters, you gain 1 life.{T}: Add {G} or {W}.",NA,NA,"legal","legal","Land",NA,NA,NA,NA,NA,"normal","https://api.scryfall.com/cards/search?order=released&q=oracleid%3A45429b2c-be3b-4b2e-9bab-a059ccbda8cd&unique=prints","common",NA,"Not flying","Not deathtouch","Not haste","Not vigilance","Land","Blossoming Sands",NA
"Bria, Riptide Rogue","{2}{U}{R}",4,"Prowess (Whenever you cast a noncreature spell, this creature gets +1/+1 until end of turn.)Other creatures you control have prowess. (If a creature has multiple instances of prowess, each triggers separately.)Whenever you cast a noncreature spell, target creature you control can't be blocked this turn.",3,3,"legal","legal","Legendary Creature — Otter Rogue","Prowess",NA,NA,NA,NA,"normal","https://api.scryfall.com/cards/search?order=released&q=oracleid%3Ad627996b-cbcd-4162-bd13-9ab286de64d1&unique=prints","mythic",1,"Not flying","Not deathtouch","Not haste","Not vigilance","Creature","Bria, Riptide Rogue",NA
"Mockingbird","{X}{U}",1,"FlyingYou may have this creature enter as a copy of any creature on the battlefield with mana value less than or equal to the amount of mana spent to cast this creature, except it's a Bird in addition to its other types and it has flying.",1,1,"legal","legal","Creature — Bird Bard","Flying",NA,NA,NA,NA,"normal","https://api.scryfall.com/cards/search?order=released&q=oracleid%3Ab9df2cdf-397c-458d-89cf-911568737ffa&unique=prints","rare",1,"Flying","Not deathtouch","Not haste","Not vigilance","Creature","Mockingbird",NA
"Alania, Divergent Storm","{3}{U}{R}",5,"Whenever you cast a spell, if it's the first instant spell, the first sorcery spell, or the first Otter spell other than Alania you've cast this turn, you may have target opponent draw a card. If you do, copy that spell. You may choose new targets for the copy.",3,5,"legal","legal","Legendary Creature — Otter Wizard",NA,NA,NA,NA,NA,"normal","https://api.scryfall.com/cards/search?order=released&q=oracleid%3A63d50d5e-56de-44c4-b906-b2a21a56e3f3&unique=prints","rare",NA,"Not flying","Not deathtouch","Not haste","Not vigilance","Creature","Alania, Divergent Storm",NA
"Coruscation Mage","{1}{R}",2,"Offspring {2} (You may pay an additional {2} as you cast this spell. If you do, when this creature enters, create a 1/1 token copy of it.)Whenever you cast a noncreature spell, this creature deals 1 damage to each opponent.",2,2,"legal","legal","Creature — Otter Wizard","Offspring",NA,NA,NA,NA,"normal","https://api.scryfall.com/cards/search?order=released&q=oracleid%3A88bb91b5-2ccd-4ce9-8cd4-e54d63c12abf&unique=prints","uncommon",1,"Not flying","Not deathtouch","Not haste","Not vigilance","Creature","Coruscation Mage",NA
"Quaketusk Boar","{3}{R}{R}",5,"Reach, trample, haste",5,5,"legal","legal","Creature — Elemental Boar","Reach","Haste","Trample",NA,NA,"normal","https://api.scryfall.com/cards/search?order=released&q=oracleid%3A6fbaa853-48d4-4a3b-b22d-27415cc266d7&unique=prints","uncommon",3,"Not flying","Not deathtouch","Haste","Not vigilance","Creature","Quaketusk Boar",NA
"Alania's Pathmaker","{3}{R}",4,"When this creature enters, exile the top card of your library. Until the end of your next turn, you may play that card.",4,2,"legal","legal","Creature — Otter Wizard",NA,NA,NA,NA,NA,"normal","https://api.scryfall.com/cards/search?order=released&q=oracleid%3Ace36a450-68a6-4519-a9f0-0e3b772054eb&unique=prints","common",NA,"Not flying","Not deathtouch","Not haste","Not vigilance","Creature","Alanias Pathmaker",NA
"Bellowing Crier","{1}{U}",2,"When this creature enters, draw a card, then discard a card.",2,1,"legal","legal","Creature — Frog Advisor",NA,NA,NA,NA,NA,"normal","https://api.scryfall.com/cards/search?order=released&q=oracleid%3Af2f3be8a-5ea1-47c2-8104-747f4589f5e6&unique=prints","common",NA,"Not flying","Not deathtouch","Not haste","Not vigilance","Creature","Bellowing Crier",NA
"Thieving Otter","{2}{U}",3,"Whenever this creature deals damage to an opponent, draw a card.",2,2,"legal","legal","Creature — Otter",NA,NA,NA,NA,NA,"normal","https://api.scryfall.com/cards/search?order=released&q=oracleid%3A5dee663f-9e2e-4503-8086-fc51664fdf29&unique=prints","common",NA,"Not flying","Not deathtouch","Not haste","Not vigilance","Creature","Thieving Otter",NA
"Waterspout Warden","{2}{U}",3,"Whenever this creature attacks, if another creature entered the battlefield under your control this turn, this creature gains flying until end of turn.",3,2,"legal","legal","Creature — Frog Soldier",NA,NA,NA,NA,NA,"normal","https://api.scryfall.com/cards/search?order=released&q=oracleid%3A5e11386f-4667-47f7-b280-eabd927e4a46&unique=prints","common",NA,"Not flying","Not deathtouch","Not haste","Not vigilance","Creature","Waterspout Warden",NA
"Flame Lash","{3}{R}",4,"Flame Lash deals 4 damage to any target.",NA,NA,"legal","legal","Instant",NA,NA,NA,NA,NA,"normal","https://api.scryfall.com/cards/search?order=released&q=oracleid%3Ac65e804b-9222-4fa8-88d1-df06a3279f22&unique=prints","common",NA,"Not flying","Not deathtouch","Not haste","Not vigilance","Instant","Flame Lash",NA
"Rabid Gnaw","{1}{R}",2,"Target creature you control gets +1/+0 until end of turn. Then it deals damage equal to its power to target creature you don't control.",NA,NA,"legal","legal","Instant",NA,NA,NA,NA,NA,"normal","https://api.scryfall.com/cards/search?order=released&q=oracleid%3A077ae62d-ed94-4365-a8b7-97fd99cff028&unique=prints","uncommon",NA,"Not flying","Not deathtouch","Not haste","Not vigilance","Instant","Rabid Gnaw",NA
"Mind Spring","{X}{U}{U}",2,"Draw X cards.",NA,NA,"legal","legal","Sorcery",NA,NA,NA,NA,NA,"normal","https://api.scryfall.com/cards/search?order=released&q=oracleid%3A3428287b-cfd5-45bc-b5f9-1e3f5a425a68&unique=prints","rare",NA,"Not flying","Not deathtouch","Not haste","Not vigilance","Sorcery","Mind Spring",NA
"Pearl of Wisdom","{2}{U}",3,"This spell costs {1} less to cast if you control an Otter.Draw two cards.",NA,NA,"legal","legal","Sorcery",NA,NA,NA,NA,NA,"normal","https://api.scryfall.com/cards/search?order=released&q=oracleid%3A91ddd2bd-2dec-4670-8edb-e89c009b2187&unique=prints","common",NA,"Not flying","Not deathtouch","Not haste","Not vigilance","Sorcery","Pearl of Wisdom",NA
"Charmed Sleep","{1}{U}{U}",3,"Enchant creatureWhen this Aura enters, tap enchanted creature.Enchanted creature doesn't untap during its controller's untap step.",NA,NA,"legal","legal","Enchantment — Aura","Enchant",NA,NA,NA,NA,"normal","https://api.scryfall.com/cards/search?order=released&q=oracleid%3Acb33edaf-b604-48b8-8b9c-d6e462a8bebb&unique=prints","common",1,"Not flying","Not deathtouch","Not haste","Not vigilance","Enchantment","Charmed Sleep",NA
"Sword of Vengeance","{3}",3,"Equipped creature gets +2/+0 and has first strike, vigilance, trample, and haste.Equip {3}",NA,NA,"legal","legal","Artifact — Equipment","Equip",NA,NA,NA,NA,"normal","https://api.scryfall.com/cards/search?order=released&q=oracleid%3Ae366afb3-c447-4bde-b358-41c8568142d5&unique=prints","rare",1,"Not flying","Not deathtouch","Not haste","Not vigilance","Artifact","Sword of Vengeance",NA
"Swiftwater Cliffs",NA,0,"This land enters tapped.When this land enters, you gain 1 life.{T}: Add {U} or {R}.",NA,NA,"legal","legal","Land",NA,NA,NA,NA,NA,"normal","https://api.scryfall.com/cards/search?order=released&q=oracleid%3A2f4ad084-2062-44c0-9975-15f100204531&unique=prints","common",NA,"Not flying","Not deathtouch","Not haste","Not vigilance","Land","Swiftwater Cliffs",NA
"Caustic Exhale","{B}",1,"As an additional cost to cast this spell, behold a Dragon or pay {1}. (To behold a Dragon, choose a Dragon you control or reveal a Dragon card from your hand.)Target creature gets -3/-3 until end of turn.",NA,NA,"not_legal","not_legal","Instant",NA,NA,NA,NA,NA,"normal","https://api.scryfall.com/cards/search?order=released&q=oracleid%3Ac4023e1f-26e3-4225-98d0-3d33f6654616&unique=prints","common",NA,"Not flying","Not deathtouch","Not haste","Not vigilance","Instant","Caustic Exhale",NA
"Sagu Pummeler","{3}{G}",4,"ReachRenew — {4}{G}, Exile this card from your graveyard: Put two +1/+1 counters and a reach counter on target creature. Activate only as a sorcery.",4,4,"not_legal","not_legal","Creature — Beast","Reach",NA,NA,NA,NA,"normal","https://api.scryfall.com/cards/search?order=released&q=oracleid%3A00f1d167-c143-471d-bd52-da2a65d087c4&unique=prints","common",1,"Not flying","Not deathtouch","Not haste","Not vigilance","Creature","Sagu Pummeler",NA
"Bearer of Glory","{1}{W}",2,"During your turn, this creature has first strike.{4}{W}: Creatures you control get +1/+1 until end of turn.",2,1,"not_legal","not_legal","Creature — Human Soldier",NA,NA,NA,NA,NA,"normal","https://api.scryfall.com/cards/search?order=released&q=oracleid%3A963947d5-5fe4-49cd-be0c-0bdb5f7bcbb6&unique=prints","common",NA,"Not flying","Not deathtouch","Not haste","Not vigilance","Creature","Bearer of Glory",NA
"Unending Whisper","{U}",1,"Draw a card.Harmonize {5}{U} (You may cast this card from your graveyard for its harmonize cost. You may tap a creature you control to reduce that cost by {X}, where X is its power. Then exile this spell.)",NA,NA,"not_legal","not_legal","Sorcery",NA,NA,NA,NA,NA,"normal","https://api.scryfall.com/cards/search?order=released&q=oracleid%3Ac5da5c31-0cf1-4393-8701-eda7880ecebc&unique=prints","common",NA,"Not flying","Not deathtouch","Not haste","Not vigilance","Sorcery","Unending Whisper",NA
"Reputable Merchant","{2/W}{2/B}{2/G}",6,"When this creature enters or dies, put a +1/+1 counter on target creature you control.",2,2,"not_legal","not_legal","Creature — Human Citizen",NA,NA,NA,NA,NA,"normal","https://api.scryfall.com/cards/search?order=released&q=oracleid%3A62f09a5b-d7fb-44f4-9fab-719185b735ab&unique=prints","common",NA,"Not flying","Not deathtouch","Not haste","Not vigilance","Creature","Reputable Merchant",NA
"Watcher of the Wayside","{3}",3,"When this creature enters, target player mills two cards. You gain 2 life. (To mill two cards, a player puts the top two cards of their library into their graveyard.)",3,2,"not_legal","not_legal","Artifact Creature — Golem","Mill",NA,NA,NA,NA,"normal","https://api.scryfall.com/cards/search?order=released&q=oracleid%3Ab30eafed-2755-4423-9592-c8b83c68804b&unique=prints","common",1,"Not flying","Not deathtouch","Not haste","Not vigilance","Creature","Watcher of the Wayside",NA
"Lightfoot Technique","{1}{W}",2,"Put a +1/+1 counter on target creature. It gains flying and indestructible until end of turn. (Damage and effects that say ""destroy"" don't destroy it.)",NA,NA,"not_legal","not_legal","Instant",NA,NA,NA,NA,NA,"normal","https://api.scryfall.com/cards/search?order=released&q=oracleid%3A601b7481-19fc-4779-950e-883a9a22aec3&unique=prints","common",NA,"Not flying","Not deathtouch","Not haste","Not vigilance","Instant","Lightfoot Technique",NA
"Hundred-Battle Veteran","{3}{B}",4,"As long as there are three or more different kinds of counters among creatures you control, this creature gets +2/+4.You may cast this card from your graveyard. If you do, it enters with a finality counter on it. (If a creature with a finality counter on it would die, exile it instead.)",4,2,"not_legal","not_legal","Creature — Zombie Warrior",NA,NA,NA,NA,NA,"normal","https://api.scryfall.com/cards/search?order=released&q=oracleid%3A9ed6aa5b-4369-42f7-9853-aae1ac9b17e2&unique=prints","uncommon",NA,"Not flying","Not deathtouch","Not haste","Not vigilance","Creature","Hundred-Battle Veteran",NA
"Descendant of Storms","{W}",1,"Whenever this creature attacks, you may pay {1}{W}. If you do, it endures 1. (Put a +1/+1 counter on it or create a 1/1 white Spirit creature token.)",2,1,"not_legal","not_legal","Creature — Human Soldier",NA,NA,NA,NA,NA,"normal","https://api.scryfall.com/cards/search?order=released&q=oracleid%3Aca773c52-ca64-463c-99cf-e71b59d2cff7&unique=prints","uncommon",NA,"Not flying","Not deathtouch","Not haste","Not vigilance","Creature","Descendant of Storms",NA
"Sandsteppe Citadel",NA,0,"This land enters tapped.{T}: Add {W}, {B}, or {G}.",NA,NA,"not_legal","legal","Land",NA,NA,NA,NA,NA,"normal","https://api.scryfall.com/cards/search?order=released&q=oracleid%3A544dbabd-cbfc-40da-a5ba-2fea9cddb453&unique=prints","uncommon",NA,"Not flying","Not deathtouch","Not haste","Not vigilance","Land","Sandsteppe Citadel",NA
"Thunder of Unity","{R}{W}{B}",3,"(As this Saga enters step, add a lore counter. Sacrifice after III.)I — You draw two cards and you lose 2 life.II, III — Whenever a creature you control enters this turn, each opponent loses 1 life and you gain 1 life.",NA,NA,"not_legal","not_legal","Enchantment — Saga",NA,NA,NA,NA,NA,"normal","https://api.scryfall.com/cards/search?order=released&q=oracleid%3A8419d1d5-bb0e-4a2d-bb6f-67957d035dde&unique=prints","rare",NA,"Not flying","Not deathtouch","Not haste","Not vigilance","Enchantment","Thunder of Unity",NA
"Delta Bloodflies","{1}{B}",2,"FlyingWhenever this creature attacks, if you control a creature with a counter on it, each opponent loses 1 life.",1,2,"not_legal","not_legal","Creature — Insect","Flying",NA,NA,NA,NA,"normal","https://api.scryfall.com/cards/search?order=released&q=oracleid%3A8a64cf8e-ae7f-4697-93fc-9c946eb1088b&unique=prints","common",1,"Flying","Not deathtouch","Not haste","Not vigilance","Creature","Delta Bloodflies",NA
"Twin Bolt","{1}{R}",2,"Twin Bolt deals 2 damage divided as you choose among one or two targets.",NA,NA,"not_legal","legal","Instant",NA,NA,NA,NA,NA,"normal","https://api.scryfall.com/cards/search?order=released&q=oracleid%3A970dc070-3668-4584-9904-2897b27bb806&unique=prints","common",NA,"Not flying","Not deathtouch","Not haste","Not vigilance","Instant","Twin Bolt",NA
"Ainok Wayfarer","{1}{G}",2,"When this creature enters, mill three cards. You may put a land card from among them into your hand. If you don't, put a +1/+1 counter on this creature. (Το mill three cards, put the top three cards of your library into your graveyard.)",1,1,"not_legal","not_legal","Creature — Dog Scout","Mill",NA,NA,NA,NA,"normal","https://api.scryfall.com/cards/search?order=released&q=oracleid%3A8134f3fd-197a-4b44-a370-311cc955dea3&unique=prints","common",1,"Not flying","Not deathtouch","Not haste","Not vigilance","Creature","Ainok Wayfarer",NA
"Temur Tawnyback","{2/G}{2/U}{2/R}",6,"When this creature enters, draw a card, then discard a card.",4,3,"not_legal","not_legal","Creature — Beast",NA,NA,NA,NA,NA,"normal","https://api.scryfall.com/cards/search?order=released&q=oracleid%3A889d26d6-9e6c-4cc0-8e8e-dd932f705a20&unique=prints","common",NA,"Not flying","Not deathtouch","Not haste","Not vigilance","Creature","Temur Tawnyback",NA
"Heritage Reclamation","{1}{G}",2,"Choose one —• Destroy target artifact.• Destroy target enchantment.• Exile up to one target card from a graveyard. Draw a card.",NA,NA,"not_legal","not_legal","Instant",NA,NA,NA,NA,NA,"normal","https://api.scryfall.com/cards/search?order=released&q=oracleid%3A09955b4b-6052-4c27-8b63-9548482b3c5c&unique=prints","common",NA,"Not flying","Not deathtouch","Not haste","Not vigilance","Instant","Heritage Reclamation",NA
"Spectral Denial","{X}{U}",1,"This spell costs {1} less to cast for each creature you control with power 4 or greater.Counter target spell unless its controller pays {X}.",NA,NA,"not_legal","not_legal","Instant",NA,NA,NA,NA,NA,"normal","https://api.scryfall.com/cards/search?order=released&q=oracleid%3Af8536726-993b-4100-918c-e3c7177d4c65&unique=prints","uncommon",NA,"Not flying","Not deathtouch","Not haste","Not vigilance","Instant","Spectral Denial",NA
"Stalwart Successor","{1}{B}{G}",3,"Menace (This creature can't be blocked except by two or more creatures.)Whenever one or more counters are put on a creature you control, if it's the first time counters have been put on that creature this turn, put a +1/+1 counter on that creature.",3,2,"not_legal","not_legal","Creature — Human Warrior","Menace",NA,NA,NA,NA,"normal","https://api.scryfall.com/cards/search?order=released&q=oracleid%3A45392882-e4b9-4c74-a10f-985c2b4e2be9&unique=prints","uncommon",1,"Not flying","Not deathtouch","Not haste","Not vigilance","Creature","Stalwart Successor",NA
"Jeskai Shrinekeeper","{2}{U}{R}{W}",5,"Flying, hasteWhenever this creature deals combat damage to a player, you gain 1 life and draw a card.",3,3,"not_legal","not_legal","Creature — Dragon","Flying","Haste",NA,NA,NA,"normal","https://api.scryfall.com/cards/search?order=released&q=oracleid%3Abb50b4f4-f0da-4283-821b-6d74bd20752f&unique=prints","uncommon",2,"Flying","Not deathtouch","Haste","Not vigilance","Creature","Jeskai Shrinekeeper",NA
"Desperate Measures","{B}",1,"Target creature gets +1/-1 until end of turn. When it dies under your control this turn, draw two cards.",NA,NA,"not_legal","not_legal","Instant",NA,NA,NA,NA,NA,"normal","https://api.scryfall.com/cards/search?order=released&q=oracleid%3Af1f3df1c-5c51-445a-b66d-eee4aab23691&unique=prints","uncommon",NA,"Not flying","Not deathtouch","Not haste","Not vigilance","Instant","Desperate Measures",NA
"Eshki Dragonclaw","{1}{G}{U}{R}",4,"Vigilance, trample, ward {1}At the beginning of combat on your turn, if you've cast both a creature spell and a noncreature spell this turn, draw a card and put two +1/+1 counters on Eshki Dragonclaw.",4,4,"not_legal","not_legal","Legendary Creature — Human Warrior","Vigilance","Trample","Ward",NA,NA,"normal","https://api.scryfall.com/cards/search?order=released&q=oracleid%3A85d87087-48ee-4dc8-a1c0-9c9ccb885adc&unique=prints","rare",3,"Not flying","Not deathtouch","Not haste","Vigilance","Creature","Eshki Dragonclaw",NA
